"Story","Title","Result","Date","Stability","Duration (s)"
"Browse the catalog","Colin reviews our range of products","SUCCESS","2021-12-22T04:11:14.082817221Z[Etc/UTC]","0.0","29.12"
"Browse the catalog","Colin reviews more of our range of products by hand","SUCCESS","2021-12-22T04:11:43.878399193Z[Etc/UTC]","0.0","0.14"
"Browse the catalog","Colin views information about each product","SUCCESS","2021-12-22T04:11:44.283026236Z[Etc/UTC]","0.0","25.17"
"Browse the catalog","Colin views the details for specific products","SUCCESS","2021-12-22T04:12:09.502032333Z[Etc/UTC]","0.0","13.13"
"Browse the catalog","Sort products","SUCCESS","2021-12-22T04:12:22.651584235Z[Etc/UTC]","0.0","6.2"
