"Story","Title","Result","Date","Stability","Duration (s)"
"Managing the cart","Colin adds ignored items to the cart","IGNORED","2021-12-22T04:00:55.439037267Z[Etc/UTC]","0.0","0.11"
"Managing the cart","Colin adds pending items to the cart","PENDING","2021-12-22T04:00:55.580232357Z[Etc/UTC]","0.0","0.14"
"Managing the cart","Colin adds skipped items to the cart","SKIPPED","2021-12-22T04:00:55.763577061Z[Etc/UTC]","0.0","0.15"
"Browse the catalog","Colin reviews our range of products by hand","PENDING","2021-12-22T04:00:24.515170602Z[Etc/UTC]","0.0","0.3"
"Browse the catalog","Colin reviews more of our range of products by hand","SUCCESS","2021-12-22T04:00:24.881156568Z[Etc/UTC]","0.0","0.22"
"Browse the catalog","Colin reviews more of our range of products by hand and finds a problem","FAILURE","2021-12-22T04:00:25.170816191Z[Etc/UTC]","0.0","0.23"
