"Story","Title","Result","Date","Stability","Duration (s)"
"Managing the cart","Colin adds ignored items to the cart","IGNORED","2021-12-22T04:14:59.928794367Z[Etc/UTC]","0.0","0.07"
"Managing the cart","Colin adds pending items to the cart","PENDING","2021-12-22T04:15:00.022792654Z[Etc/UTC]","0.0","0.07"
"Managing the cart","Colin adds skipped items to the cart","SKIPPED","2021-12-22T04:15:00.116720839Z[Etc/UTC]","0.0","0.09"
"Browse the catalog","Colin reviews our range of products by hand","PENDING","2021-12-22T04:14:29.096228448Z[Etc/UTC]","0.0","0.37"
"Browse the catalog","Colin reviews more of our range of products by hand","SUCCESS","2021-12-22T04:14:29.543345697Z[Etc/UTC]","0.0","0.2"
"Browse the catalog","Colin reviews more of our range of products by hand and finds a problem","FAILURE","2021-12-22T04:14:29.803369737Z[Etc/UTC]","0.0","0.16"
